{
  "v": 1,
  "miner_id": "miner-001",
  "ts": 1791799259000,
  "scenario": "festival_smog",
  "sensors_simulated": true,
  "aqi": 392,
  "sensors": {
    "pm25_ugm3": 182.4,
    "pm10_ugm3": 265.1,
    "co2_ppm": 612.0,
    "voc_index": 240,
    "no2_ppb": 58.2,
    "so2_ppb": 11.4,
    "co_ppm": 1.9,
    "temp_c": 27.3,
    "humidity_pct": 64.0,
    "pressure_hpa": 913.2
  },
  "gps": {
    "lat": 12.9716,
    "lon": 77.5946,
    "alt_m": 920.0,
    "fix": "3d",
    "hdop": 0.9,
    "satellites": 9,
    "ts": 1791799259000
  },
  "plants": [
    {
      "tag_id": 0,
      "species": "snake_plant",
      "status": "present",
      "leaf_area_cm2": 310.0,
      "alive_score": 0.86,
      "species_conf": 0.91,
      "rate_air_per_h": 0.072
    },
    {
      "tag_id": 1,
      "species": "peace_lily",
      "status": "present",
      "leaf_area_cm2": 317.0,
      "alive_score": 0.86,
      "species_conf": 0.91,
      "rate_air_per_h": 0.072
    },
    {
      "tag_id": 2,
      "species": "bamboo_palm",
      "status": "present",
      "leaf_area_cm2": 324.0,
      "alive_score": 0.86,
      "species_conf": 0.91,
      "rate_air_per_h": 0.072
    },
    {
      "tag_id": 3,
      "species": "red_edged_dracaena",
      "status": "present",
      "leaf_area_cm2": 331.0,
      "alive_score": 0.86,
      "species_conf": 0.91,
      "rate_air_per_h": 0.072
    },
    {
      "tag_id": 4,
      "species": "janet_craig_dracaena",
      "status": "present",
      "leaf_area_cm2": 338.0,
      "alive_score": 0.86,
      "species_conf": 0.91,
      "rate_air_per_h": 0.072
    },
    {
      "tag_id": 5,
      "species": "english_ivy",
      "status": "present",
      "leaf_area_cm2": 345.0,
      "alive_score": 0.86,
      "species_conf": 0.91,
      "rate_air_per_h": 0.072
    },
    {
      "tag_id": 6,
      "species": "chinese_evergreen",
      "status": "present",
      "leaf_area_cm2": 352.0,
      "alive_score": 0.86,
      "species_conf": 0.91,
      "rate_air_per_h": 0.072
    },
    {
      "tag_id": 7,
      "species": "florists_chrysanthemum",
      "status": "missing",
      "leaf_area_cm2": 0.0,
      "alive_score": 0.86,
      "species_conf": 0.91,
      "rate_air_per_h": 0.0
    },
    {
      "tag_id": 8,
      "species": "weeping_fig",
      "status": "present",
      "leaf_area_cm2": 366.0,
      "alive_score": 0.86,
      "species_conf": 0.91,
      "rate_air_per_h": 0.072
    },
    {
      "tag_id": 9,
      "species": "money_plant",
      "status": "present",
      "leaf_area_cm2": 373.0,
      "alive_score": 0.86,
      "species_conf": 0.91,
      "rate_air_per_h": 0.072
    },
    {
      "tag_id": 10,
      "species": "spider_plant",
      "status": "present",
      "leaf_area_cm2": 380.0,
      "alive_score": 0.86,
      "species_conf": 0.91,
      "rate_air_per_h": 0.072
    },
    {
      "tag_id": 11,
      "species": "aloe_vera",
      "status": "present",
      "leaf_area_cm2": 387.0,
      "alive_score": 0.86,
      "species_conf": 0.91,
      "rate_air_per_h": 0.072
    },
    {
      "tag_id": 12,
      "species": "areca_palm",
      "status": "suspect",
      "leaf_area_cm2": 394.0,
      "alive_score": 0.12,
      "species_conf": 0.91,
      "rate_air_per_h": 0.0
    },
    {
      "tag_id": 13,
      "species": "boston_fern",
      "status": "present",
      "leaf_area_cm2": 401.0,
      "alive_score": 0.86,
      "species_conf": 0.91,
      "rate_air_per_h": 0.072
    },
    {
      "tag_id": 14,
      "species": "tulsi",
      "status": "present",
      "leaf_area_cm2": 408.0,
      "alive_score": 0.86,
      "species_conf": 0.91,
      "rate_air_per_h": 0.072
    },
    {
      "tag_id": 15,
      "species": "hibiscus",
      "status": "present",
      "leaf_area_cm2": 415.0,
      "alive_score": 0.86,
      "species_conf": 0.91,
      "rate_air_per_h": 0.072
    },
    {
      "tag_id": 16,
      "species": "neem",
      "status": "present",
      "leaf_area_cm2": 422.0,
      "alive_score": 0.86,
      "species_conf": 0.91,
      "rate_air_per_h": 0.072
    },
    {
      "tag_id": 17,
      "species": "shisham",
      "status": "present",
      "leaf_area_cm2": 429.0,
      "alive_score": 0.86,
      "species_conf": 0.91,
      "rate_air_per_h": 0.072
    },
    {
      "tag_id": 18,
      "species": "bougainvillea",
      "status": "present",
      "leaf_area_cm2": 436.0,
      "alive_score": 0.86,
      "species_conf": 0.91,
      "rate_air_per_h": 0.072
    },
    {
      "tag_id": 19,
      "species": "yellow_oleander",
      "status": "present",
      "leaf_area_cm2": 443.0,
      "alive_score": 0.86,
      "species_conf": 0.91,
      "rate_air_per_h": 0.072
    }
  ],
  "current_epoch": {
    "epoch": 29863320,
    "start_ms": 1791799200000,
    "end_ms": 1791799260000,
    "running_air": 0.0205
  },
  "flags": [
    {
      "code": "plant_missing",
      "severity": "warn",
      "ts": 1791799254000,
      "tag_id": 7,
      "message": "Tag 7 unseen for 15 s"
    },
    {
      "code": "low_liveness",
      "severity": "critical",
      "ts": 1791799231000,
      "tag_id": 12,
      "message": "alive_score 0.12 (possible fake plant)"
    }
  ],
  "uplink": {
    "online": true,
    "queued_attestations": 0
  },
  "device": {
    "cpu_temp_c": 61.2,
    "cpu_pct": 48.0,
    "mem_pct": 37.5,
    "uptime_s": 5400
  }
}
